{
  "$schema": "http://json-schema.org/draft-07/schema#",
  "title": "Junkstronaut game parameters",
  "description": "The Economy Balancer's output, and the crew's headline artifact. This is the object that becomes config/game_params.tres — the one file the game loads and the only place a tunable value may live.",
  "type": "object",
  "required": [
    "agent",
    "flight",
    "cargo",
    "reentry",
    "ablation",
    "landing",
    "tow_fee",
    "eva",
    "economy",
    "upgrades",
    "balance_notes"
  ],
  "additionalProperties": false,
  "properties": {
    "agent": { "const": "economy-balancer" },
    "flight": {
      "type": "object",
      "required": ["dry_mass_kg", "fuel_capacity_kg", "thrust_n", "fuel_burn_kgs"],
      "properties": {
        "dry_mass_kg": { "type": "number", "exclusiveMinimum": 0 },
        "fuel_capacity_kg": { "type": "number", "exclusiveMinimum": 0 },
        "thrust_n": { "type": "number", "exclusiveMinimum": 0 },
        "fuel_burn_kgs": { "type": "number", "exclusiveMinimum": 0 }
      }
    },
    "cargo": {
      "type": "object",
      "required": ["base_slots", "compactor_tier"],
      "properties": {
        "base_slots": { "type": "integer", "minimum": 1 },
        "compactor_tier": { "type": "integer", "minimum": 1, "maximum": 3 }
      }
    },
    "reentry": {
      "type": "object",
      "required": ["heat_capacity", "heat_dissipation_s", "cargo_damage_interval_s", "commit_floor_m"],
      "properties": {
        "heat_capacity": { "type": "number", "exclusiveMinimum": 0 },
        "commit_floor_m": {
          "description": "The shallowest committed entry the player may fly, in metres. This is the rule the endgame rests on. Without it a player buys the same speed reduction a skim gives by simply entering shallower, for one heat cycle instead of two, and NO heat capacity can separate a plunge from a skimmed descent — measured at every scale height from 800 m to 3100 m. With it, flying shallow to stay cool is off the table and skimming is the only way left to arrive slower. Must be well below atmosphere_top_m or it constrains nothing.",
          "type": "number",
          "minimum": 0
        },
        "heat_dissipation_s": { "type": "number", "exclusiveMinimum": 0 },
        "cargo_damage_interval_s": { "type": "number", "exclusiveMinimum": 0 }
      }
    },
    "ablation": {
      "description": "The model is stated in the Economy Balancer's charter and is the single definition the game, the audit and the report all use. A descent is k shallow skims followed by one committed entry, so k+1 heat cycles: cost(band,k) = SUM(i=0..k) cycle_toll_base_pct * cycle_toll_growth^i + heat_cost_coefficient * (heat_index[band] * skim_heat_multiplier[k])^heat_cost_exponent + k * heat_cost_coefficient * skim_peak^heat_cost_exponent. cost_curve is the Balancer's own evaluation of it, so nothing downstream reconstructs the model from prose. This replaces an earlier model that divided peak heat by pass count; flying it showed a committed entry's peak is set by entry depth and ballistic coefficient, not by how many passes preceded it.",
      "type": "object",
      "required": [
        "cycle_toll_base_pct",
        "cycle_toll_growth",
        "heat_cost_coefficient",
        "heat_cost_exponent",
        "skim_peak",
        "skim_heat_multiplier",
        "heat_index",
        "cost_curve",
        "plate_capacity_pct",
        "optimal_skims"
      ],
      "properties": {
        "cycle_toll_base_pct": {
          "description": "Thermal-fatigue toll for the first heat cycle, in percent of plate.",
          "type": "number", "exclusiveMinimum": 0
        },
        "cycle_toll_growth": {
          "description": "Multiplier applied per subsequent cycle. Must exceed 1: a flat toll is linear in skim count and cannot hold the optimum in place.",
          "type": "number", "exclusiveMinimum": 1
        },
        "heat_cost_coefficient": { "type": "number", "exclusiveMinimum": 0 },
        "heat_cost_exponent": { "type": "number", "minimum": 1 },
        "skim_peak": {
          "description": "Peak heat of one shallow skim pass on the 0-100 bar. Skims are cool; the committed entry dominates.",
          "type": "number", "exclusiveMinimum": 0
        },
        "skim_heat_multiplier": {
          "description": "Factor on the committed entry's peak after 0, 1, 2 and 3 skims. Starts at 1.0, non-increasing, floored at 0.15 — skimming cools the entry but the benefit saturates once the orbit is grazing. The floor was 0.4, chosen before the simulator could measure this quantity properly; with the skim altitude scanned rather than hardcoded, 13% of sampled grid worlds measure below 0.4 and the lowest reads 0.277. A floor above what the flight model actually produces is worse than no floor: the Auditor's instruction to adopt the measured values would be unsatisfiable, and the Balancer would fail its schema three times and kill the run rather than report the problem.",
          "type": "array",
          "minItems": 4,
          "maxItems": 4,
          "items": { "type": "number", "minimum": 0.15, "maximum": 1 }
        },
        "heat_index": {
          "description": "Peak heat of a DIRECT entry from each band, no skims, on the 0-100 heat bar.",
          "type": "object",
          "required": ["bottom", "middle", "top"],
          "patternProperties": {
            "^(bottom|middle|top)$": { "type": "number", "exclusiveMinimum": 0 }
          }
        },
        "cost_curve": {
          "description": "Plate burned for 0..3 skims, per band. Exactly four numbers each, in skim order.",
          "type": "object",
          "required": ["bottom", "middle", "top"],
          "patternProperties": {
            "^(bottom|middle|top)$": {
              "type": "array",
              "minItems": 4,
              "maxItems": 4,
              "items": { "type": "number", "minimum": 0 }
            }
          }
        },
        "plate_capacity_pct": { "type": "number", "exclusiveMinimum": 0 },
        "optimal_skims": {
          "description": "0-based index of each cost_curve's minimum. The high band must be 1 or 2, and no band may exceed it, so the return leg gets harder with altitude.",
          "type": "object",
          "required": ["bottom", "middle", "top"],
          "patternProperties": {
            "^(bottom|middle|top)$": { "type": "integer", "minimum": 0, "maximum": 3 }
          }
        }
      }
    },
    "landing": {
      "description": "The canopy is stated, not implied. parachute_area_m2 and parachute_drag_coefficient are required because without them the simulator had to solve the area backwards from descent_speed_full_hold_ms and then measure that same speed — a check of the claim against itself. With both stated, the descent is flown from the physical canopy and descent_speed_full_hold_ms becomes a prediction the flight can contradict.",
      "type": "object",
      "required": [
        "soft_landing_ms",
        "damage_per_ms_over",
        "no_gear_multiplier",
        "fragile_multiplier",
        "parachute_area_m2",
        "parachute_drag_coefficient",
        "descent_speed_full_hold_ms"
      ],
      "properties": {
        "soft_landing_ms": { "type": "number", "exclusiveMinimum": 0 },
        "damage_per_ms_over": { "type": "number", "exclusiveMinimum": 0 },
        "no_gear_multiplier": { "type": "number", "minimum": 1 },
        "fragile_multiplier": { "type": "number", "minimum": 1 },
        "parachute_area_m2": {
          "description": "Canopy reference area. The simulator flies this; it does not infer it.",
          "type": "number", "exclusiveMinimum": 0
        },
        "parachute_drag_coefficient": {
          "description": "Canopy drag coefficient. Required alongside the area so the terminal velocity is fully determined by the params rather than by a default living in the model.",
          "type": "number", "exclusiveMinimum": 0
        },
        "descent_speed_full_hold_ms": {
          "description": "Predicted touchdown speed at base storage with a full hold. The Auditor flies the stated canopy and fails this if the measurement disagrees, so it is a claim about the flight and not a target the area was fitted to.",
          "type": "number", "exclusiveMinimum": 0
        }
      }
    },
    "tow_fee": {
      "type": "object",
      "required": ["free_radius_m", "max_fee_fraction"],
      "properties": {
        "free_radius_m": { "type": "number", "minimum": 0 },
        "max_fee_fraction": { "type": "number", "minimum": 0, "maximum": 0.5 },
        "curve": { "type": "string" }
      }
    },
    "eva": {
      "type": "object",
      "required": [
        "suit_mass_kg",
        "jetpack_thrust_n",
        "jetpack_fuel_kg",
        "base_tether_slots",
        "magnet_hold_force_n"
      ],
      "properties": {
        "suit_mass_kg": { "type": "number", "exclusiveMinimum": 0 },
        "jetpack_thrust_n": { "type": "number", "exclusiveMinimum": 0 },
        "jetpack_fuel_kg": { "type": "number", "exclusiveMinimum": 0 },
        "base_tether_slots": { "type": "integer", "minimum": 1, "maximum": 4 },
        "magnet_hold_force_n": { "type": "number", "exclusiveMinimum": 0 }
      }
    },
    "economy": {
      "type": "object",
      "required": [
        "launch_cost",
        "value_gradient",
        "size_class_base_value",
        "fragile_value_premium"
      ],
      "properties": {
        "launch_cost": { "type": "number", "exclusiveMinimum": 0 },
        "replate_cost_per_pct": { "type": "number", "minimum": 0 },
        "repair_cost_per_pct": { "type": "number", "minimum": 0 },
        "value_gradient": {
          "description": "GDD 2.6's value gradient, replacing the old per-band multiplier map. A piece's multiplier interpolates linearly on its altitude between the floor and the ceiling of the band: at_bottom at altitude_min_m, at_top at altitude_max_m. at_top must exceed at_bottom — height is where the money is, and that is what makes the risk curve and the value curve rise together without discrete tiers to keep in sync.",
          "type": "object",
          "required": ["at_bottom", "at_top"],
          "additionalProperties": false,
          "properties": {
            "at_bottom": { "type": "number", "exclusiveMinimum": 0 },
            "at_top": { "type": "number", "exclusiveMinimum": 0 }
          }
        },
        "size_class_base_value": {
          "type": "object",
          "required": ["small", "medium", "oversized"],
          "patternProperties": {
            "^(small|medium|oversized)$": { "type": "number", "exclusiveMinimum": 0 }
          }
        },
        "fragile_value_premium": { "type": "number", "minimum": 1 }
      }
    },
    "upgrades": {
      "type": "array",
      "minItems": 12,
      "maxItems": 12,
      "items": {
        "type": "object",
        "required": ["part", "tier", "cost", "effect", "value"],
        "properties": {
          "part": {
            "enum": ["fuel_tank", "thruster", "storage", "heat_shield", "parachute", "hand_magnet"]
          },
          "tier": { "type": "integer", "minimum": 1, "maximum": 2 },
          "cost": { "type": "number", "exclusiveMinimum": 0 },
          "effect": { "type": "string", "minLength": 3 },
          "value": { "type": "number" }
        }
      }
    },
    "balance_notes": {
      "type": "array",
      "minItems": 5,
      "items": { "type": "string", "minLength": 20 }
    },
    "catalog_concerns": {
      "description": "The Balancer's channel for reporting a problem in the debris catalog it was given. It may never re-author the catalog itself — a second copy of the loot table is two sources of truth, and the fix silently reverts the moment anyone reads the original. Raising a concern here routes the finding to the Debris Designer, which is the agent that owns that data.",
      "type": "array",
      "maxItems": 8,
      "items": { "type": "string", "minLength": 20 }
    }
  }
}
