{
  "agent": "economy-balancer",
  "flight": {
    "dry_mass_kg": 108,
    "fuel_capacity_kg": 360,
    "thrust_n": 7000,
    "fuel_burn_kgs": 2,
    "rcs_thrust_n": 300,
    "rcs_fuel_burn_kgs": 0.05,
    "rotation_rate_degs": 90
  },
  "cargo": {
    "base_slots": 6,
    "compactor_tier": 1
  },
  "reentry": {
    "heat_capacity": 232,
    "heat_dissipation_s": 5,
    "cargo_damage_interval_s": 3,
    "commit_floor_m": 8000,
    "unstaged_heat_multiplier": 3,
    "off_retrograde_penalty": 1
  },
  "ablation": {
    "cycle_toll_base_pct": 5,
    "cycle_toll_growth": 1.9,
    "heat_cost_coefficient": 0.000007,
    "heat_cost_exponent": 3,
    "skim_peak": 67,
    "skim_heat_multiplier": [
      1,
      0.377,
      0.377,
      0.377
    ],
    "heat_index": {
      "bottom": 100,
      "middle": 129.5,
      "top": 169.1
    },
    "cost_curve": {
      "bottom": [
        12,
        16.98,
        37.14,
        73.54
      ],
      "middle": [
        20.2,
        17.42,
        37.58,
        73.98
      ],
      "top": [
        38.85,
        18.42,
        38.57,
        74.97
      ]
    },
    "plate_capacity_pct": 100,
    "optimal_skims": {
      "bottom": 0,
      "middle": 1,
      "top": 1
    }
  },
  "landing": {
    "soft_landing_ms": 5,
    "damage_per_ms_over": 6,
    "no_gear_multiplier": 2,
    "fragile_multiplier": 2,
    "parachute_area_m2": 85,
    "parachute_drag_coefficient": 1.5,
    "descent_speed_full_hold_ms": 4.61
  },
  "tow_fee": {
    "free_radius_m": 1200,
    "max_fee_fraction": 0.5,
    "curve": "linear"
  },
  "eva": {
    "suit_mass_kg": 110,
    "jetpack_thrust_n": 240,
    "jetpack_fuel_kg": 18,
    "jetpack_burn_kgs": 0.35,
    "base_tether_slots": 2,
    "magnet_hold_force_n": 900,
    "magnet_range_screens": 0.125,
    "latch_jerk_coefficient": 1,
    "swing_jerk_coefficient": 1
  },
  "economy": {
    "launch_cost": 95,
    "replate_cost_per_pct": 2,
    "repair_cost_per_pct": 5,
    "value_gradient": {
      "at_bottom": 1,
      "at_top": 5.5
    },
    "size_class_base_value": {
      "small": 40,
      "medium": 90,
      "oversized": 320
    },
    "fragile_value_premium": 3
  },
  "upgrades": [
    {
      "part": "fuel_tank",
      "tier": 1,
      "cost": 350,
      "effect": "fuel_capacity_kg",
      "value": 460
    },
    {
      "part": "fuel_tank",
      "tier": 2,
      "cost": 900,
      "effect": "fuel_capacity_kg",
      "value": 560
    },
    {
      "part": "thruster",
      "tier": 1,
      "cost": 400,
      "effect": "thrust_n",
      "value": 8500
    },
    {
      "part": "thruster",
      "tier": 2,
      "cost": 1000,
      "effect": "thrust_n",
      "value": 10000
    },
    {
      "part": "storage",
      "tier": 1,
      "cost": 600,
      "effect": "base_slots",
      "value": 8
    },
    {
      "part": "storage",
      "tier": 2,
      "cost": 1500,
      "effect": "base_slots",
      "value": 10
    },
    {
      "part": "heat_shield",
      "tier": 1,
      "cost": 500,
      "effect": "heat_capacity",
      "value": 235
    },
    {
      "part": "heat_shield",
      "tier": 2,
      "cost": 1300,
      "effect": "heat_capacity",
      "value": 238
    },
    {
      "part": "parachute",
      "tier": 1,
      "cost": 300,
      "effect": "parachute_area_m2",
      "value": 105
    },
    {
      "part": "parachute",
      "tier": 2,
      "cost": 800,
      "effect": "parachute_area_m2",
      "value": 125
    },
    {
      "part": "hand_magnet",
      "tier": 1,
      "cost": 250,
      "effect": "magnet_hold_force_n",
      "value": 1400
    },
    {
      "part": "hand_magnet",
      "tier": 2,
      "cost": 700,
      "effect": "magnet_hold_force_n",
      "value": 2000
    }
  ],
  "balance_notes": [
    "GDD 2.5, full hold roughly doubles the ship at base storage. Computed the way the crew computes it: spawn-weighted across the shipping slice (bottom and middle thirds, hand-tetherable only, non-fragile crushing at compactor_tier 1) the catalog runs 19.66 kg per slot, so 6 base slots is 117.9 kg. dry_mass_kg 108 gives (108 + 117.9) / 108 = 2.09, inside the 25% window with room either side. dry_mass_kg moved 96 -> 108 to buy ascent margin (finding 2) and 108 is the top of what the doubling rule allows: the legal range is 86.3 to 143.9 kg. base_slots stays 6 because GDD 2.2 puts it on screen.",
    "Finding 2, shipping_slice_reachable. The audit was right that the old ship was drag-limited rather than delta-v-limited, and measurement says the lever is exhaust velocity, not thrust: at thrust_n 5200 the flight model reaches 64,416 m of apex at fuel_burn_kgs 2.17 and 73,293 m at 1.73, on the same TWR. So the burn was stretched instead of enlarged. thrust_n 7000 over fuel_burn_kgs 2.0 is an exhaust velocity of 3,500 m/s; wet mass 108 + 360 = 468 kg gives ideal dv = 3500 * ln(468/108) = 3500 * 1.466 = 5,132 m/s against the old 1,892, and a 180 s burn against the old ~72 s, so most of it is spent above the dense air rather than against it. Liftoff TWR is 7000 / (468 * 9) = 1.66, barely moved from the old 1.62 — the fix is not thrust. Flown: the base ship's ballistic arc apexes at 73,759 m against a 65,000 m band floor with a 135 s EVA window and 26.5% of the tank left, and the circularised route also closes with 16.9% left. Both routes reach the middle and top samples too, which is more than the rule asks; see the note on what altitude is and is not gated by.",
    "Finding 1, heavy_descent_requires_multi_pass. commit_floor_m stays at 8,000 m — 35 km below atmosphere_top_m 43,000 and 8 km above ground — and every peak below is the coolest legal single pass, entry pinned at that floor. Flown from the top of the band: empty 158.2, half hold 196.8, full hold 229.0, endgame haul (solar_wing_spine, 142.5 kg, the heaviest piece in the catalog) 241.0; the endgame haul at one skim is 161.0 and at two is 155.3. The satisfiable window for the whole capacity ladder is therefore [229.0, 241.0), and the ladder is now inside it: base heat_capacity 232, heat_shield tier 1 235, tier 2 238. The old ladder put 235 and 255 above the endgame peak of 224, which is exactly the 'a maxed shield buys the plunge back' failure. All three parts hold: the endgame haul cannot stay under any tier on one pass (241.0 > 238), it comes home on one skim (161.0 < 232), and an empty ship and a full hold still plunge from anywhere in the band (bottom 95.5 / 141, middle 122 / 178, top 158 / 229, all under 232).",
    "Finding 1, the part I could not widen, stated because the next revision will hit it too. The window is 12.0 bar-units, 5.3% — and it is 5.3% at every commit floor I measured (2,000 m: 242.7 vs 255.7; 14,000 m: 211.1 vs 221.9), because peak heat goes as roughly the square root of ship mass and the endgame haul is only 10.9% heavier than a full hold (250.5 kg against 225.9 kg all-up). That is not a tuning choice: GDD 2.5 says a full hold roughly doubles the ship and GDD 2.6 says the module roughly doubles the ship, so the design's own prose puts them at the same mass and drives the window to zero. It is non-zero only because the catalog's heaviest piece happens to be 1.21x a full base hold. Three tiers fit at ~1.3% spacing and no re-pricing widens them; widening needs the endgame object to be heavier than a full hold, which is not a number I own.",
    "GDD 2.2, the ablation model, evaluated rather than asserted. cost(sample,k) = SUM(i=0..k) 5.0 * 1.9^i + 7.0e-6 * (heat_index[sample] * skim_heat_multiplier[k])^3 + k * 7.0e-6 * 67^3. skim_heat_multiplier is the flown array from the top sample, [1.0, 0.377, 0.377, 0.377] — adopted exactly as the charter instructs, measured with the skim altitude scanned to 32,250 m and the entry depth held fixed, and flat after index 1 as the saturation rule requires. heat_index is the direct-entry peak on the same measurement basis the array came from: bottom 100.0 (the calibration point), middle 129.5, top 169.1. Cumulative tolls are 5.0 / 14.5 / 32.55 / 66.845 and each skim adds 7.0e-6 * 300,763 = 2.105. Top, term by term: entries 7.0e-6 * [169.1, 63.75, 63.75, 63.75]^3 = 33.85 / 1.81 / 1.81 / 1.81, skims 0 / 2.11 / 4.21 / 6.32, totals 38.85 / 18.42 / 38.57 / 74.97, minimum at index 1. Middle 20.20 / 17.42 / 37.58 / 73.98, minimum at 1. Bottom 12.00 / 16.98 / 37.14 / 73.54, minimum at 0. So the cheap end of the band plunges home and the top two thirds pay for a skim, and no sample's optimum exceeds the top's.",
    "GDD 2.2, why heat_index is not the same number as the capacity ladder above it, since the last audit spotted the gap. heat_index is measured at entry depth 0 — a periapsis on the ground — because that is where the simulator's skim study measures skim_heat_multiplier, and the two have to share a basis or the product means nothing. The capacity ladder is measured at the commit floor, 8,000 m, because that is the shallowest entry the design lets a player fly. Same bar, two entry depths, and the direct entries run about 7% hotter at depth 0 (169.1 against 158.2 empty at the top). Neither figure is wrong; a periapsis-0 entry is simply not a legal descent, so it prices the skim model and does not set the capacity.",
    "GDD 2.3, the parachute, stated as a canopy. parachute_area_m2 85 at parachute_drag_coefficient 1.5, against the Researcher's rho0 = 1.5 and g = 9.0, on the flown full-hold mass of 108 + 117.9 = 225.9 kg: v = sqrt(2 * 225.9 * 9.0 / (1.5 * 1.5 * 85)) = sqrt(4066.2 / 191.25) = sqrt(21.26) = 4.61 m/s. That is descent_speed_full_hold_ms, and the flight model integrates the same canopy to 4.61 m/s. It sits 0.39 m/s under the 5.0 soft line and well above 3.5, so the Parachute upgrade is a real purchase and not a formality.",